{
  "method_id": "birdclef2026_htsat_strong",
  "model": {
    "family": "hierarchical_audio_transformer",
    "name": "htsat",
    "variant": "base",
    "pretraining_source": "AudioSet_or_equivalent_audio_pretraining",
    "frontend": "logmel_128x512",
    "num_parameters_estimate": 31000000
  },
  "optimizer": {
    "name": "adamw",
    "lr": 0.00015,
    "weight_decay": 0.01,
    "betas": [0.9, 0.999]
  },
  "scheduler": {
    "name": "cosine",
    "warmup_epochs": 3
  },
  "training": {
    "epochs": 24,
    "batch_size": 48,
    "label_smoothing": 0.03,
    "amp": true,
    "ema": true,
    "loss": "bce_focal",
    "segment_seconds": 5,
    "sample_rate": 32000
  },
  "augmentations": [
    "specaugment",
    "time_shift",
    "random_gain",
    "background_mix"
  ],
  "regularization": [
    "focal_loss",
    "ema",
    "group_aware_cv"
  ],
  "hypothesis": {
    "statement": "HTS-AT-style hierarchical audio transformers should offer a strong score-to-compute tradeoff on BirdCLEF 2026 by preserving transformer capacity while reducing training and inference cost relative to larger AST-style models.",
    "expected_information_gain": "Provides a compute-efficient contender against AST and BEATs-style backbones."
  }
}
