{
  "method_id": "cifar100_wrn28x10_no_mixup",
  "model": {
    "family": "wideresnet",
    "name": "wideresnet",
    "depth": 28,
    "widen_factor": 10,
    "dropout": 0.3,
    "num_parameters_estimate": 36479140
  },
  "optimizer": {
    "name": "sam_sgd",
    "lr": 0.1,
    "momentum": 0.9,
    "nesterov": true,
    "weight_decay": 0.0005,
    "rho": 0.05,
    "adaptive": false
  },
  "scheduler": {
    "name": "cosine",
    "warmup_epochs": 5
  },
  "training": {
    "epochs": 200,
    "batch_size": 256,
    "label_smoothing": 0.1,
    "mixup_alpha": 0.0,
    "amp": true,
    "ema": false,
    "sharpness_aware": {
      "start_epoch": 141
    }
  },
  "augmentations": [
    "random_crop_32_pad_4",
    "random_horizontal_flip",
    "randaugment",
    "random_erasing",
    "normalize"
  ],
  "regularization": [
    "label_smoothing",
    "late_sam"
  ],
  "hypothesis": {
    "statement": "Removing Mixup should lower robustness and generalization if part of the gain comes from target interpolation rather than optimizer geometry alone.",
    "expected_information_gain": "Separates data-space regularization from late-phase sharpness-aware optimization."
  }
}
